{
  "generatedAt": "2026-10-16T16:40:24.359Z",
  "source": {
    "name": "Google Lighthouse",
    "service": "PageSpeed Insights API",
    "category": "accessibility"
  },
  "standard": "WCAG 2.2 AA",
  "apps": {
    "marin-os": {
      "status": "success",
      "url": "https://marincountygov.github.io/marin-os/",
      "score": 100,
      "testedAt": "2026-10-16T16:38:40.419Z",
      "lighthouseVersion": "13.5.0",
      "audits": [
        {
          "id": "focusable-controls",
          "title": "Interactive controls are keyboard focusable",
          "score": null,
          "status": "manual"
        },
        {
          "id": "interactive-element-affordance",
          "title": "Interactive elements indicate their purpose and state",
          "score": null,
          "status": "manual"
        },
        {
          "id": "logical-tab-order",
          "title": "The page has a logical tab order",
          "score": null,
          "status": "manual"
        },
        {
          "id": "visual-order-follows-dom",
          "title": "Visual order on the page follows DOM order",
          "score": null,
          "status": "manual"
        },
        {
          "id": "focus-traps",
          "title": "User focus is not accidentally trapped in a region",
          "score": null,
          "status": "manual"
        },
        {
          "id": "managed-focus",
          "title": "The user's focus is directed to new content added to the page",
          "score": null,
          "status": "manual"
        },
        {
          "id": "use-landmarks",
          "title": "HTML5 landmark elements are used to improve navigation",
          "score": null,
          "status": "manual"
        },
        {
          "id": "offscreen-content-hidden",
          "title": "Offscreen content is hidden from assistive technology",
          "score": null,
          "status": "manual"
        },
        {
          "id": "custom-controls-labels",
          "title": "Custom controls have associated labels",
          "score": null,
          "status": "manual"
        },
        {
          "id": "custom-controls-roles",
          "title": "Custom controls have ARIA roles",
          "score": null,
          "status": "manual"
        }
      ]
    },
    "marin-magic": {
      "status": "success",
      "url": "https://marincountygov.github.io/marin-magic/",
      "score": 100,
      "testedAt": "2026-10-16T16:38:47.144Z",
      "lighthouseVersion": "13.5.0",
      "audits": [
        {
          "id": "focusable-controls",
          "title": "Interactive controls are keyboard focusable",
          "score": null,
          "status": "manual"
        },
        {
          "id": "interactive-element-affordance",
          "title": "Interactive elements indicate their purpose and state",
          "score": null,
          "status": "manual"
        },
        {
          "id": "logical-tab-order",
          "title": "The page has a logical tab order",
          "score": null,
          "status": "manual"
        },
        {
          "id": "visual-order-follows-dom",
          "title": "Visual order on the page follows DOM order",
          "score": null,
          "status": "manual"
        },
        {
          "id": "focus-traps",
          "title": "User focus is not accidentally trapped in a region",
          "score": null,
          "status": "manual"
        },
        {
          "id": "managed-focus",
          "title": "The user's focus is directed to new content added to the page",
          "score": null,
          "status": "manual"
        },
        {
          "id": "use-landmarks",
          "title": "HTML5 landmark elements are used to improve navigation",
          "score": null,
          "status": "manual"
        },
        {
          "id": "offscreen-content-hidden",
          "title": "Offscreen content is hidden from assistive technology",
          "score": null,
          "status": "manual"
        },
        {
          "id": "custom-controls-labels",
          "title": "Custom controls have associated labels",
          "score": null,
          "status": "manual"
        },
        {
          "id": "custom-controls-roles",
          "title": "Custom controls have ARIA roles",
          "score": null,
          "status": "manual"
        }
      ]
    },
    "marin-docs": {
      "status": "success",
      "url": "https://marincountygov.github.io/marin-docs/",
      "score": 100,
      "testedAt": "2026-10-16T16:38:53.558Z",
      "lighthouseVersion": "13.5.0",
      "audits": [
        {
          "id": "focusable-controls",
          "title": "Interactive controls are keyboard focusable",
          "score": null,
          "status": "manual"
        },
        {
          "id": "interactive-element-affordance",
          "title": "Interactive elements indicate their purpose and state",
          "score": null,
          "status": "manual"
        },
        {
          "id": "logical-tab-order",
          "title": "The page has a logical tab order",
          "score": null,
          "status": "manual"
        },
        {
          "id": "visual-order-follows-dom",
          "title": "Visual order on the page follows DOM order",
          "score": null,
          "status": "manual"
        },
        {
          "id": "focus-traps",
          "title": "User focus is not accidentally trapped in a region",
          "score": null,
          "status": "manual"
        },
        {
          "id": "managed-focus",
          "title": "The user's focus is directed to new content added to the page",
          "score": null,
          "status": "manual"
        },
        {
          "id": "use-landmarks",
          "title": "HTML5 landmark elements are used to improve navigation",
          "score": null,
          "status": "manual"
        },
        {
          "id": "offscreen-content-hidden",
          "title": "Offscreen content is hidden from assistive technology",
          "score": null,
          "status": "manual"
        },
        {
          "id": "custom-controls-labels",
          "title": "Custom controls have associated labels",
          "score": null,
          "status": "manual"
        },
        {
          "id": "custom-controls-roles",
          "title": "Custom controls have ARIA roles",
          "score": null,
          "status": "manual"
        }
      ]
    },
    "marin-brand": {
      "status": "success",
      "url": "https://marincountygov.github.io/marin-brand/",
      "score": 100,
      "testedAt": "2026-10-16T16:39:00.972Z",
      "lighthouseVersion": "13.5.0",
      "audits": [
        {
          "id": "focusable-controls",
          "title": "Interactive controls are keyboard focusable",
          "score": null,
          "status": "manual"
        },
        {
          "id": "interactive-element-affordance",
          "title": "Interactive elements indicate their purpose and state",
          "score": null,
          "status": "manual"
        },
        {
          "id": "logical-tab-order",
          "title": "The page has a logical tab order",
          "score": null,
          "status": "manual"
        },
        {
          "id": "visual-order-follows-dom",
          "title": "Visual order on the page follows DOM order",
          "score": null,
          "status": "manual"
        },
        {
          "id": "focus-traps",
          "title": "User focus is not accidentally trapped in a region",
          "score": null,
          "status": "manual"
        },
        {
          "id": "managed-focus",
          "title": "The user's focus is directed to new content added to the page",
          "score": null,
          "status": "manual"
        },
        {
          "id": "use-landmarks",
          "title": "HTML5 landmark elements are used to improve navigation",
          "score": null,
          "status": "manual"
        },
        {
          "id": "offscreen-content-hidden",
          "title": "Offscreen content is hidden from assistive technology",
          "score": null,
          "status": "manual"
        },
        {
          "id": "custom-controls-labels",
          "title": "Custom controls have associated labels",
          "score": null,
          "status": "manual"
        },
        {
          "id": "custom-controls-roles",
          "title": "Custom controls have ARIA roles",
          "score": null,
          "status": "manual"
        }
      ]
    },
    "marin-mentions": {
      "status": "success",
      "url": "https://marincountygov.github.io/marin-mentions/",
      "score": 100,
      "testedAt": "2026-10-16T16:39:09.763Z",
      "lighthouseVersion": "13.5.0",
      "audits": [
        {
          "id": "focusable-controls",
          "title": "Interactive controls are keyboard focusable",
          "score": null,
          "status": "manual"
        },
        {
          "id": "interactive-element-affordance",
          "title": "Interactive elements indicate their purpose and state",
          "score": null,
          "status": "manual"
        },
        {
          "id": "logical-tab-order",
          "title": "The page has a logical tab order",
          "score": null,
          "status": "manual"
        },
        {
          "id": "visual-order-follows-dom",
          "title": "Visual order on the page follows DOM order",
          "score": null,
          "status": "manual"
        },
        {
          "id": "focus-traps",
          "title": "User focus is not accidentally trapped in a region",
          "score": null,
          "status": "manual"
        },
        {
          "id": "managed-focus",
          "title": "The user's focus is directed to new content added to the page",
          "score": null,
          "status": "manual"
        },
        {
          "id": "use-landmarks",
          "title": "HTML5 landmark elements are used to improve navigation",
          "score": null,